{
  "schemaVersion": 1,
  "purpose": "Every tracked path must map to the set of flags it touches. Classification is cumulative (a path that touches both UI and harness is flagged with both). Unknown paths fail.",
  "default": "OTHER",
  "classes": {
    "UI_PRODUCT": ["touchesApplicationUI"],
    "HARNESS": ["touchesHarness"],
    "POLICIES": ["touchesPolicies"],
    "QUALIFICATION": ["touchesQualification"],
    "DOCUMENTATION": ["touchesDocumentationOnly"],
    "CONFIGURATION": ["touchesConfiguration"],
    "INFRASTRUCTURE": ["touchesInfrastructure"],
    "GENERATED": ["touchesGeneratedOutput"],
    "REFERENCE": ["touchesReference"],
    "OTHER": []
  },
  "rules": [
    {
      "match": "packages/app/src/**",
      "flags": ["touchesApplicationUI"]
    },
    {
      "match": "packages/ui/src/**",
      "flags": ["touchesApplicationUI"]
    },
    {
      "match": "packages/app/scripts/parity/**",
      "flags": ["touchesHarness"]
    },
    {
      "match": "packages/app/e2e/v110/parity/**",
      "flags": ["touchesHarness"]
    },
    {
      "match": "packages/app/e2e/v110/parity-manifest/**",
      "flags": ["touchesHarness"]
    },
    {
      "match": "packages/app/e2e/v110/**/*.spec.ts",
      "flags": ["touchesQualification"]
    },
    {
      "match": "parity/schemas/**",
      "flags": ["touchesPolicies"]
    },
    {
      "match": "parity/*.json",
      "flags": ["touchesPolicies"]
    },
    {
      "match": "parity/*.md",
      "flags": ["touchesDocumentationOnly"]
    },
    {
      "match": "docs/ui-reference/v110/Unifia-UI-UX-v110-PORT-READY-R1.html",
      "flags": ["touchesReference"]
    },
    {
      "match": "package.json",
      "flags": ["touchesConfiguration"]
    },
    {
      "match": "bun.lock",
      "flags": ["touchesConfiguration"]
    },
    {
      "match": "tsconfig.json",
      "flags": ["touchesConfiguration"]
    },
    {
      "match": "biome.json",
      "flags": ["touchesConfiguration"]
    },
    {
      "match": "playwright.config.*",
      "flags": ["touchesConfiguration", "touchesInfrastructure"]
    },
    {
      "match": "vite.config.*",
      "flags": ["touchesConfiguration", "touchesInfrastructure"]
    },
    {
      "match": "vitest.config.*",
      "flags": ["touchesConfiguration"]
    },
    {
      "match": "Dockerfile",
      "flags": ["touchesInfrastructure"]
    },
    {
      "match": "docker-compose.yml",
      "flags": ["touchesInfrastructure"]
    },
    {
      "match": "README*",
      "flags": ["touchesDocumentationOnly"]
    },
    {
      "match": "README.*",
      "flags": ["touchesDocumentationOnly"]
    },
    {
      "match": "LICENSE*",
      "flags": ["touchesDocumentationOnly"]
    },
    {
      "match": "LICENSE.*",
      "flags": ["touchesDocumentationOnly"]
    },
    {
      "match": "CONTRIBUTING*",
      "flags": ["touchesDocumentationOnly"]
    },
    {
      "match": "CONTRIBUTING.*",
      "flags": ["touchesDocumentationOnly"]
    },
    {
      "match": "SECURITY*",
      "flags": ["touchesDocumentationOnly"]
    },
    {
      "match": "SECURITY.*",
      "flags": ["touchesDocumentationOnly"]
    },
    {
      "match": "CHANGELOG*",
      "flags": ["touchesDocumentationOnly"]
    },
    {
      "match": "docs/**",
      "flags": ["touchesDocumentationOnly"]
    },
    {
      "match": "AGENTS.md",
      "flags": ["touchesDocumentationOnly"]
    },
    {
      "match": "CLAUDE.md",
      "flags": ["touchesDocumentationOnly"]
    },
    {
      "match": "*.md",
      "flags": ["touchesDocumentationOnly"]
    },
    {
      "match": "**/*.md",
      "flags": ["touchesDocumentationOnly"]
    },
    {
      "match": "**/*.toml",
      "flags": ["touchesConfiguration"]
    },
    {
      "match": ".dockerignore",
      "flags": ["touchesConfiguration"]
    },
    {
      "match": ".editorconfig",
      "flags": ["touchesConfiguration"]
    },
    {
      "match": ".gitignore",
      "flags": ["touchesConfiguration"]
    },
    {
      "match": ".gitattributes",
      "flags": ["touchesConfiguration"]
    },
    {
      "match": ".gitleaks.toml",
      "flags": ["touchesConfiguration"]
    },
    {
      "match": ".prettierignore",
      "flags": ["touchesConfiguration"]
    },
    {
      "match": ".env.example",
      "flags": ["touchesConfiguration"]
    },
    {
      "match": ".eslintrc.restrict.cjs",
      "flags": ["touchesConfiguration"]
    },
    {
      "match": ".tmp-commit-msg.md",
      "flags": ["touchesDocumentationOnly"]
    },
    {
      "match": "bunfig.toml",
      "flags": ["touchesConfiguration"]
    },
    {
      "match": "knip.json",
      "flags": ["touchesConfiguration"]
    },
    {
      "match": "renovate.json",
      "flags": ["touchesConfiguration"]
    },
    {
      "match": "sst-env.d.ts",
      "flags": ["touchesConfiguration"]
    },
    {
      "match": "sst.config.ts",
      "flags": ["touchesConfiguration", "touchesInfrastructure"]
    },
    {
      "match": "flake.lock",
      "flags": ["touchesConfiguration"]
    },
    {
      "match": "flake.nix",
      "flags": ["touchesConfiguration"]
    },
    {
      "match": ".husky/**",
      "flags": ["touchesConfiguration"]
    },
    {
      "match": ".vscode/**",
      "flags": ["touchesConfiguration"]
    },
    {
      "match": ".github/**",
      "flags": ["touchesConfiguration", "touchesInfrastructure"]
    },
    {
      "match": "CODEOWNERS",
      "flags": ["touchesDocumentationOnly"]
    },
    {
      "match": "CODE_OF_CONDUCT.md",
      "flags": ["touchesDocumentationOnly"]
    },
    {
      "match": "Makefile",
      "flags": ["touchesConfiguration", "touchesInfrastructure"]
    },
    {
      "match": ".artifacts/**",
      "flags": ["touchesGeneratedOutput"]
    },
    {
      "match": ".opencode/**",
      "flags": ["touchesDocumentationOnly"]
    },
    {
      "match": ".claude/**",
      "flags": ["touchesDocumentationOnly"]
    },
    {
      "match": ".codex/**",
      "flags": ["touchesDocumentationOnly"]
    },
    {
      "match": ".codex-work/**",
      "flags": ["touchesDocumentationOnly"]
    },
    {
      "match": ".gstack/**",
      "flags": ["touchesDocumentationOnly"]
    },
    {
      "match": ".mavis/**",
      "flags": ["touchesDocumentationOnly"]
    },
    {
      "match": ".openhands/**",
      "flags": ["touchesDocumentationOnly"]
    },
    {
      "match": ".ruff_cache/**",
      "flags": ["touchesGeneratedOutput"]
    },
    {
      "match": ".session-save/**",
      "flags": ["touchesDocumentationOnly"]
    },
    {
      "match": ".team-worktrees/**",
      "flags": ["touchesGeneratedOutput"]
    },
    {
      "match": ".turbo-local-cache/**",
      "flags": ["touchesGeneratedOutput"]
    },
    {
      "match": ".unifia/**",
      "flags": ["touchesDocumentationOnly"]
    },
    {
      "match": ".zed/**",
      "flags": ["touchesConfiguration"]
    },
    {
      "match": ".zcode-scratch/**",
      "flags": ["touchesGeneratedOutput"]
    },
    {
      "match": ".fix/**",
      "flags": ["touchesDocumentationOnly"]
    },
    {
      "match": ".debate-smoke/**",
      "flags": ["touchesGeneratedOutput"]
    },
    {
      "match": ".e2e-home/**",
      "flags": ["touchesGeneratedOutput"]
    },
    {
      "match": ".bun-install/**",
      "flags": ["touchesGeneratedOutput"]
    },
    {
      "match": ".ci-artifacts/**",
      "flags": ["touchesGeneratedOutput"]
    },
    {
      "match": ".build-temp/**",
      "flags": ["touchesGeneratedOutput"]
    },
    {
      "match": ".build-temp-g1/**",
      "flags": ["touchesGeneratedOutput"]
    },
    {
      "match": "packages/*/src/**",
      "flags": ["touchesApplicationUI"]
    },
    {
      "match": "packages/*/scripts/**",
      "flags": ["touchesConfiguration"]
    },
    {
      "match": "packages/*/e2e/**",
      "flags": ["touchesQualification"]
    },
    {
      "match": "packages/*/test/**",
      "flags": ["touchesQualification"]
    },
    {
      "match": "packages/*/docs/**",
      "flags": ["touchesDocumentationOnly"]
    },
    {
      "match": "packages/*/public/**",
      "flags": ["touchesApplicationUI"]
    },
    {
      "match": "packages/*/src-tauri/**",
      "flags": ["touchesApplicationUI"]
    },
    {
      "match": "packages/*/dist/**",
      "flags": ["touchesGeneratedOutput"]
    },
    {
      "match": "packages/*/.vite/**",
      "flags": ["touchesGeneratedOutput"]
    },
    {
      "match": "packages/*/.turbo/**",
      "flags": ["touchesGeneratedOutput"]
    },
    {
      "match": "packages/*/node_modules/**",
      "flags": ["touchesGeneratedOutput"]
    },
    {
      "match": "tools/**",
      "flags": ["touchesConfiguration"]
    },
    {
      "match": "sdks/**",
      "flags": ["touchesConfiguration"]
    },
    {
      "match": "tests/**",
      "flags": ["touchesQualification"]
    },
    {
      "match": "specs/**",
      "flags": ["touchesDocumentationOnly"]
    },
    {
      "match": "templates/**",
      "flags": ["touchesDocumentationOnly"]
    },
    {
      "match": "infra/**",
      "flags": ["touchesInfrastructure"]
    },
    {
      "match": "config/**",
      "flags": ["touchesConfiguration"]
    },
    {
      "match": "crates/**",
      "flags": ["touchesApplicationUI"]
    },
    {
      "match": "capability-packs/**",
      "flags": ["touchesConfiguration"]
    },
    {
      "match": "document-packs/**",
      "flags": ["touchesConfiguration"]
    },
    {
      "match": "work_design/**",
      "flags": ["touchesDocumentationOnly"]
    },
    {
      "match": "brand/**",
      "flags": ["touchesDocumentationOnly"]
    },
    {
      "match": "nix/**",
      "flags": ["touchesConfiguration"]
    },
    {
      "match": "patches/**",
      "flags": ["touchesConfiguration"]
    },
    {
      "match": "skill-hub/**",
      "flags": ["touchesDocumentationOnly"]
    },
    {
      "match": "skill-hub/skill/**",
      "flags": ["touchesDocumentationOnly"]
    },
    {